{
  "generated": "2026-05-10T21:05:39.860Z",
  "version": "1.0.0",
  "decks": [
    {
      "id": "api",
      "title": "Understanding APIs, REST & HTTP Requests",
      "description": "Introduction complète aux APIs web, à l'architecture RESTful et aux fondamentaux des requêtes HTTP. Découvrez comment les applications modernes communiquent sur le web.",
      "status": "published",
      "objectives": [
        "Comprendre les concepts fondamentaux des APIs",
        "Maîtriser le protocole HTTP et ses méthodes",
        "Concevoir des APIs RESTful selon les bonnes pratiques",
        "Effectuer des requêtes HTTP avec l'API Fetch en JavaScript",
        "Implémenter l'authentification et l'autorisation",
        "Gérer les erreurs et les codes de statut HTTP"
      ],
      "prerequisites": [
        "Connaissances de base en JavaScript",
        "Compréhension des concepts web (client/serveur)"
      ],
      "duration": "3 hours",
      "theme": "simplon",
      "thumbnail": "./assets/cover.png",
      "tags": [
        "api",
        "rest",
        "http",
        "swagger",
        "javascript",
        "fetch",
        "authentication",
        "backend",
        "web"
      ],
      "language": "fr",
      "version": "1.0.0",
      "authors": [
        {
          "name": "Maxime Lenne",
          "email": "hello@maxime-lenne.fr"
        }
      ],
      "created": "2025-12-20",
      "updated": "2026-01-11"
    },
    {
      "id": "api-advanced",
      "title": "Concevoir une API REST en Python avec FastAPI",
      "description": "Conception d'une API REST professionnelle avec FastAPI, Pydantic v2... Projet fil rouge : API de gestion des formations, sessions et inscriptions pour Simplon.",
      "status": "published",
      "objectives": [
        "Mettre en place une architecture FastAPI en couches (models / schemas / services / routes)",
        "Modéliser des entités avec SQLModel et définir les relations",
        "Créer des DTOs robustes avec Pydantic v2 (Create / Update / Read)",
        "Implémenter un CRUD complet avec gestion des règles métier",
        "Écrire des tests automatisés avec pytest et HTTPX (couverture ≥ 70%)",
        "Gérer les erreurs et les codes HTTP de façon centralisée",
        "Implémenter filtres, pagination et tri",
        "Générer et enrichir la documentation Swagger/OpenAPI",
        "Gérer les migrations de base de données avec Alembic"
      ],
      "prerequisites": [
        "Connaissances de base en Python (fonctions, classes, modules)",
        "Notions de REST et HTTP (verbes, codes de statut)",
        "Compréhension des bases de données relationnelles (SQL)"
      ],
      "duration": "3 hours",
      "theme": "simplon",
      "thumbnail": "./assets/cover.png",
      "tags": [
        "fastapi",
        "python",
        "pydantic",
        "api",
        "dto",
        "sqlmodel",
        "sqlalchemy",
        "alembic",
        "pytest",
        "rest",
        "backend",
        "validation",
        "tests"
      ],
      "language": "fr",
      "version": "1.0.0",
      "authors": [
        {
          "name": "Maxime Lenne",
          "email": "hello@maxime-lenne.fr"
        }
      ],
      "created": "2026-03-02",
      "updated": "2026-03-02"
    },
    {
      "id": "ci-cd",
      "title": "CI / CD",
      "description": "Introduction à l'Intégration Continue et au Déploiement Continu : principes, pipelines et bonnes pratiques pour rendre les déploiements fiables et maîtrisés. Volontairement agnostique des outils (GitHub Actions, GitLab CI, Jenkins...).",
      "status": "published",
      "objectives": [
        "Distinguer Intégration Continue, Livraison Continue et Déploiement Continu et choisir le niveau d'automatisation adapté à son contexte",
        "Identifier les composants clés d'une pipeline (jobs, stages, runners, artefacts, environnements) et leurs responsabilités",
        "Appliquer les invariants fondamentaux : build once / deploy many, immutabilité, idempotence, fail fast, feedback rapide",
        "Concevoir un pipeline minimal lint → tests → build → deploy pour un projet existant",
        "Reconnaître les anti-patterns courants et les principaux risques de sécurité d'une pipeline CI/CD"
      ],
      "prerequisites": [
        "Maîtrise de Git (commits, branches, merges, tags)",
        "Aisance avec la ligne de commande Linux",
        "Avoir déjà développé et testé un projet (même à titre scolaire)",
        "Notions de Docker (images, conteneurs, registres) — recommandé, pas obligatoire"
      ],
      "duration": "90-110 minutes (30 min intro + 45-60 min deep dive test/build/CD + 15-20 min conclusion)",
      "theme": "maxime-lenne",
      "thumbnail": "./assets/cover.svg",
      "tags": [
        "ci-cd",
        "devops",
        "automation",
        "pipelines",
        "testing",
        "build",
        "deployment",
        "github-actions",
        "gitlab-ci"
      ],
      "language": "fr",
      "version": "0.2.0",
      "authors": [
        {
          "name": "Maxime Lenne",
          "email": "hello@maxime-lenne.fr"
        }
      ],
      "created": "2026-04-29",
      "updated": "2026-04-29"
    },
    {
      "id": "ci-cd-github",
      "title": "CI/CD avec GitHub Actions",
      "description": "Maîtrisez les workflows GitHub Actions : anatomie YAML, pipeline CI complet (pytest, matrix, artifacts) et réflexes sécurité essentiels.",
      "status": "published",
      "objectives": [
        "Comprendre les concepts CI/CD (Integration, Delivery, Deployment) et le rôle de GitHub Actions dans la chaîne d'automatisation",
        "Décrypter l'anatomie d'un workflow YAML (name/on/jobs/steps) et la hiérarchie workflow → jobs → steps",
        "Construire un workflow CI complet pour un projet Python (checkout, setup-python, install, pytest, upload-artifact)",
        "Mettre en œuvre une stratégie matrix pour tester sur plusieurs versions/OS en parallèle (include/exclude, fail-fast)",
        "Identifier et éviter les erreurs courantes (checkout oublié, secrets en logs, jobs parallèles, timeout) en appliquant les 5 règles d'or"
      ],
      "prerequisites": [
        "Maîtrise de Git (clone, commit, push, branches, pull requests)",
        "Compte GitHub (gratuit) actif",
        "Aisance avec la ligne de commande Linux/macOS",
        "Avoir un projet avec des tests à automatiser (Python/Node) — recommandé",
        "Notions de YAML — recommandé, non obligatoire"
      ],
      "duration": "60 minutes",
      "theme": "maxime-lenne",
      "thumbnail": "./assets/cover.svg",
      "tags": [
        "ci-cd",
        "github-actions",
        "devops",
        "automation",
        "workflows"
      ],
      "language": "fr",
      "version": "0.3.0",
      "authors": [
        {
          "name": "Maxime Lenne",
          "email": "hello@maxime-lenne.fr"
        }
      ],
      "created": "2026-04-29",
      "updated": "2026-04-30"
    },
    {
      "id": "docker",
      "title": "Docker",
      "description": "Les bases de Docker : installation, concepts fondamentaux, avancées (build, cache) et docker compose",
      "status": "published",
      "objectives": [
        "Comprendre pourquoi Docker est incontournable et la différence avec les machines virtuelles",
        "Installer Docker sur Linux et Windows et exécuter ses premiers conteneurs",
        "Écrire un Dockerfile optimisé avec multi-stage builds et gestion du cache",
        "Maîtriser les volumes, réseaux et registres Docker",
        "Orchestrer des applications multi-services avec Docker Compose"
      ],
      "prerequisites": [
        "Bases de la ligne de commande (terminal Linux ou PowerShell)",
        "Notions de base en développement web (API, base de données)"
      ],
      "duration": "2-3 hours (45min installation et concepts fondamentaux, 1h avancées build/cache, 1h docker compose)",
      "theme": "maxime-lenne",
      "thumbnail": "./assets/cover.svg",
      "tags": [
        "docker",
        "containers",
        "devops",
        "docker-compose",
        "build"
      ],
      "language": "fr",
      "version": "0.2.0",
      "authors": [
        {
          "name": "Maxime Lenne",
          "email": "hello@maxime-lenne.fr"
        }
      ],
      "created": "2026-04-27",
      "updated": "2026-04-27"
    },
    {
      "id": "genai-ai-engineer-langchain",
      "title": "Introduction à LangChain & langGraph",
      "description": "Introduction à LangChain & langGraph — chaîner des opérations LLM pour créer des applications puissantes et modulaires.",
      "status": "published",
      "objectives": [
        "Comprendre l'architecture de LangChain",
        "Chaîner des opérations LLM (chains)",
        "Utiliser des prompts templates",
        "Intégrer des outils et agents"
      ],
      "prerequisites": [
        "Notions de base en Python",
        "Connaissance des LLMs (ChatGPT, etc.)"
      ],
      "duration": "30 minutes",
      "theme": "maxime-lenne",
      "thumbnail": "./assets/cover.png",
      "tags": [
        "langchain",
        "llm",
        "ai",
        "python",
        "langGraph",
        "nlp"
      ],
      "language": "fr",
      "version": "1.0.0",
      "authors": [
        {
          "name": "Maxime Lenne",
          "email": "hello@maxime-lenne.fr"
        }
      ],
      "created": "2025-11-24",
      "updated": "2026-03-11"
    },
    {
      "id": "sql-advanced-queries",
      "title": "SQL — Jour 2 : Jointures complexes & Agrégations",
      "description": "Maîtrise des JOINs (INNER, LEFT, RIGHT, FULL), sous-requêtes, GROUP BY, HAVING et ORDER BY pour des requêtes SQL avancées.",
      "status": "published",
      "objectives": [
        "Réaliser des jointures complexes entre plusieurs tables",
        "Écrire des sous-requêtes efficaces",
        "Utiliser GROUP BY, HAVING et ORDER BY",
        "Agréger et filtrer des données"
      ],
      "prerequisites": [